{
  "schemaVersion": 1,
  "jobId": "3f1c2a9e-6b1d-4c7e-9a52-0d8f5e3b7a10",
  "provider": "openai",
  "mix": "duck",
  "segmentCount": 42,
  "characters": 3180,
  "overflowSegments": [
    3,
    17
  ],
  "artifacts": {
    "audio": "jobs/3f1c2a9e-6b1d-4c7e-9a52-0d8f5e3b7a10/out/dub.mp3",
    "video": "jobs/3f1c2a9e-6b1d-4c7e-9a52-0d8f5e3b7a10/out/dubbed.mp4"
  }
}
